{
  "$schema": "https://json-schema.org/draft/2020-12/schema",
  "$id": "https://andrecomp.dev/schemas/prp/v1/fixture.schema.json",
  "title": "PRP scripted replay fixture",
  "type": "object",
  "required": [
    "schema",
    "fixtureVersion",
    "protocolVersion",
    "name",
    "description",
    "identity",
    "capabilities",
    "commands",
    "events",
    "result"
  ],
  "properties": {
    "schema": {
      "const": "andrecomp.prp.fixture.v1"
    },
    "fixtureVersion": {
      "const": 1
    },
    "protocolVersion": {
      "enum": [
        1,
        2,
        3
      ]
    },
    "name": {
      "type": "string",
      "minLength": 1,
      "maxLength": 120
    },
    "description": {
      "type": "string",
      "minLength": 1,
      "maxLength": 1000
    },
    "identity": {
      "$ref": "https://andrecomp.dev/schemas/prp/v1/identity.schema.json"
    },
    "capabilities": {
      "oneOf": [
        {
          "$ref": "https://andrecomp.dev/schemas/prp/v1/capabilities.schema.json"
        },
        {
          "$ref": "https://andrecomp.dev/schemas/prp/v2/capabilities.schema.json"
        },
        {
          "$ref": "https://andrecomp.dev/schemas/prp/v3/capabilities.schema.json"
        }
      ]
    },
    "commands": {
      "type": "array",
      "items": {
        "oneOf": [
          {
            "$ref": "https://andrecomp.dev/schemas/prp/v1/command.schema.json"
          },
          {
            "$ref": "https://andrecomp.dev/schemas/prp/v2/command.schema.json"
          },
          {
            "$ref": "https://andrecomp.dev/schemas/prp/v3/command.schema.json"
          }
        ]
      }
    },
    "events": {
      "type": "array",
      "minItems": 1,
      "items": {
        "oneOf": [
          {
            "$ref": "https://andrecomp.dev/schemas/prp/v1/event.schema.json"
          },
          {
            "$ref": "https://andrecomp.dev/schemas/prp/v2/event.schema.json"
          },
          {
            "$ref": "https://andrecomp.dev/schemas/prp/v3/event.schema.json"
          }
        ]
      }
    },
    "requests": {
      "type": "array",
      "items": {
        "$ref": "https://andrecomp.dev/schemas/prp/v1/request.schema.json"
      }
    },
    "result": {
      "$ref": "https://andrecomp.dev/schemas/prp/v1/result.schema.json"
    }
  },
  "additionalProperties": true
}
